{
  "product_marketing_context": {
    "source_skill_id": "ms.skill.product_marketing_context",
    "source_skill_version": "0.2.0",
    "source_output_hash": "cccccccccccccccccccccccccccccccccccccccccccccccccccccccccccccccc",
    "context_id": "ctx-001",
    "readiness": "ready",
    "source_evidence_references": [
      "ev-pmc-001"
    ],
    "source_unknowns": [
      {
        "domain": "pricing",
        "description": "PMC pricing unverified"
      }
    ],
    "source_conflicts": []
  },
  "market_research_output": {
    "source_skill_id": "ms.skill.market_research",
    "source_skill_version": "0.1.0",
    "source_output_hash": "dddddddddddddddddddddddddddddddddddddddddddddddddddddddddddddddd",
    "research_id": "res-001",
    "research_status": "partially_complete",
    "source_evidence_references": [
      "finding-cs-001"
    ],
    "source_unknowns": [
      {
        "domain": "competitor",
        "description": "Competitor list incomplete"
      }
    ],
    "source_conflicts": [
      {
        "domain": "market",
        "description": "Upstream research conflicted",
        "conflicting_claims": [
          "a",
          "b"
        ]
      }
    ]
  },
  "analysis_objectives": [
    "Map direct and indirect competitors for async PM SaaS"
  ],
  "provenance": {
    "submitted_by": "fixture",
    "notes": "fictional"
  }
}